{
  "contract_version": "v4",
  "scan_summary": {
    "scannable_file_count": 12,
    "scanned_file_count": 12,
    "skipped_file_count": 0,
    "candidate_count": 2,
    "case_count": 1,
    "suppressed_candidate_count": 1
  },
  "deliveries": [
    {
      "delivery_id": "delivery-1",
      "case_ids": [
        "case-1"
      ],
      "file_changes": [
        {
          "path": "src/webhook.ts",
          "status": "upsert",
          "content": "export function verifyRetrySignature() { return true }",
          "content_encoding": "utf-8"
        }
      ]
    }
  ],
  "case_results": [
    {
      "case_id": "case-1",
      "disposition": "keep",
      "reason": null,
      "review_record": {
        "analysis": {
          "verdict": "confirmed-vulnerability",
          "overview": "Webhook retry payloads can reuse stale signature metadata.",
          "narratives": []
        },
        "mitigation": {
          "overview": "Recompute the signature metadata before enqueueing retry payloads.",
          "changed_files": [
            "src/webhook.ts"
          ],
          "file_changes": [],
          "patch_diff": "diff --git a/src/webhook.ts b/src/webhook.ts\n+verifyRetrySignature()"
        },
        "verification": {
          "overview": "The patch covers the retry enqueue path.",
          "review_target_claim": "Retry payloads must be signed with current metadata.",
          "validation_level": "static",
          "patch_coverage": "full",
          "regression_status": "not-run",
          "resolution_next_step": "none",
          "patch_findings": [],
          "verification_findings": [],
          "residual_risks": []
        },
        "cvss": {
          "outcome": "scored",
          "base_score": 5.8,
          "severity": "medium",
          "vector": "CVSS:4.0/AV:N/AC:L/AT:N/PR:L/UI:N",
          "overview": "Authenticated users can replay stale webhook retry payloads.",
          "not_scored_reason": null
        }
      }
    }
  ]
}
